{
  "id": "Q-5.1-0049",
  "revision": 1,
  "examGuideVersion": "6.1",
  "domain": 5,
  "subObjective": "5.1",
  "caseStudy": null,
  "type": {
    "kind": "single"
  },
  "difficulty": 5,
  "wafPillars": [
    "security"
  ],
  "keywords": [
    "ダミー",
    "琥珀"
  ],
  "examSets": [
    1
  ],
  "stem": {
    "ja": "【ダミー】火山・鍵盤・砂丘・染物・灯台に関する設問。",
    "en": "Dummy question stem for Q-5.1-0049."
  },
  "choices": [
    {
      "id": "a",
      "text": {
        "ja": "竹林灯台宿場琥珀太鼓製本渓流渓流流星温室",
        "en": "Dummy choice A of Q-5.1-0049"
      },
      "isCorrect": false,
      "rationale": {
        "ja": "選択肢Aが誤り理由(ダミー)",
        "en": "Why choice A is incorrect (dummy)"
      },
      "mistakeTags": [
        "opsOverhead"
      ]
    },
    {
      "id": "b",
      "text": {
        "ja": "果樹園渡り鳥鍾乳石滝壺笛吹蜂蜜茶室羅針盤青銅彫刻彫刻楽譜製本",
        "en": "Dummy choice B of Q-5.1-0049"
      },
      "isCorrect": false,
      "rationale": {
        "ja": "選択肢Bが誤り理由(ダミー)",
        "en": "Why choice B is incorrect (dummy)"
      },
      "mistakeTags": [
        "compliance"
      ]
    },
    {
      "id": "c",
      "text": {
        "ja": "果樹園合唱鐘楼渡り鳥潮汐海溝化石羅針盤果樹園火",
        "en": "Dummy choice C of Q-5.1-0049"
      },
      "isCorrect": true,
      "rationale": {
        "ja": "選択肢Cが正しい理由(ダミー)",
        "en": "Why choice C is correct (dummy)"
      }
    },
    {
      "id": "d",
      "text": {
        "ja": "風車噴水石畳洞窟石畳火山珊瑚太鼓画廊青銅水路舞台陶器合",
        "en": "Dummy choice D of Q-5.1-0049"
      },
      "isCorrect": false,
      "rationale": {
        "ja": "選択肢Dが誤り理由(ダミー)",
        "en": "Why choice D is incorrect (dummy)"
      },
      "mistakeTags": [
        "availability"
      ]
    }
  ],
  "references": [
    {
      "title": "Google Cloud ドキュメント",
      "url": "https://cloud.google.com/docs",
      "license": "link-only"
    }
  ]
}
