{
  "id": "Q-2.3-0017",
  "revision": 1,
  "examGuideVersion": "6.1",
  "domain": 2,
  "subObjective": "2.3",
  "caseStudy": null,
  "type": {
    "kind": "single"
  },
  "difficulty": 3,
  "wafPillars": [
    "sustainability"
  ],
  "keywords": [
    "ダミー",
    "峡谷"
  ],
  "examSets": [
    1
  ],
  "stem": {
    "ja": "【ダミー】灯台・望遠鏡・陶器・鍵盤・樹氷に関する設問。",
    "en": "Dummy question stem for Q-2.3-0017."
  },
  "choices": [
    {
      "id": "a",
      "text": {
        "ja": "竹林果樹園時計塔噴水渡り鳥陶器刺繍星",
        "en": "Dummy choice A of Q-2.3-0017"
      },
      "isCorrect": false,
      "rationale": {
        "ja": "選択肢Aが誤り理由(ダミー)",
        "en": "Why choice A is incorrect (dummy)"
      },
      "mistakeTags": [
        "opsOverhead"
      ]
    },
    {
      "id": "b",
      "text": {
        "ja": "彗星帆船画廊火山化石鍵盤鍾乳石宿場雪原果樹園砂丘鐘楼洞窟洞",
        "en": "Dummy choice B of Q-2.3-0017"
      },
      "isCorrect": false,
      "rationale": {
        "ja": "選択肢Bが誤り理由(ダミー)",
        "en": "Why choice B is incorrect (dummy)"
      },
      "mistakeTags": [
        "compliance"
      ]
    },
    {
      "id": "c",
      "text": {
        "ja": "合唱湿原鍾乳石彗星化石笛吹棚田鍾乳石舞台織機",
        "en": "Dummy choice C of Q-2.3-0017"
      },
      "isCorrect": false,
      "rationale": {
        "ja": "選択肢Cが誤り理由(ダミー)",
        "en": "Why choice C is incorrect (dummy)"
      },
      "mistakeTags": [
        "scalability"
      ]
    },
    {
      "id": "d",
      "text": {
        "ja": "果樹園劇場染物劇場帆船羅針盤竹林帆船水路洞窟風",
        "en": "Dummy choice D of Q-2.3-0017"
      },
      "isCorrect": true,
      "rationale": {
        "ja": "選択肢Dが正しい理由(ダミー)",
        "en": "Why choice D is correct (dummy)"
      }
    }
  ],
  "references": [
    {
      "title": "Google Cloud ドキュメント",
      "url": "https://cloud.google.com/docs",
      "license": "link-only"
    }
  ]
}
