{
  "id": "Q-NET.1-0019",
  "revision": 1,
  "examGuideVersion": "1.0",
  "domain": 2,
  "subObjective": "NET.1",
  "caseStudy": null,
  "type": {
    "kind": "single"
  },
  "difficulty": 5,
  "wafPillars": [
    "efficiency"
  ],
  "keywords": [
    "ダミー",
    "蜂蜜"
  ],
  "examSets": [
    1
  ],
  "stem": {
    "ja": "【ダミー】砂丘・鐘楼・峡谷・流星・笛吹に関する設問。",
    "en": "Dummy question stem for Q-NET.1-0019."
  },
  "choices": [
    {
      "id": "a",
      "text": {
        "ja": "湿原劇場羅針盤竹林滝壺鍾乳",
        "en": "Dummy choice A of Q-NET.1-0019"
      },
      "isCorrect": false,
      "rationale": {
        "ja": "選択肢Aが誤り理由(ダミー)",
        "en": "Why choice A is incorrect (dummy)"
      },
      "mistakeTags": [
        "scalability"
      ]
    },
    {
      "id": "b",
      "text": {
        "ja": "果樹園流星陶器滝壺潮汐太鼓庭園雪原水路月面刺繍渓流棚田青",
        "en": "Dummy choice B of Q-NET.1-0019"
      },
      "isCorrect": false,
      "rationale": {
        "ja": "選択肢Bが誤り理由(ダミー)",
        "en": "Why choice B is incorrect (dummy)"
      },
      "mistakeTags": [
        "availability"
      ]
    },
    {
      "id": "c",
      "text": {
        "ja": "陶器渓流琥珀彫刻棚田潮汐砂丘時計塔望遠鏡樹氷",
        "en": "Dummy choice C of Q-NET.1-0019"
      },
      "isCorrect": true,
      "rationale": {
        "ja": "選択肢Cが正しい理由(ダミー)",
        "en": "Why choice C is correct (dummy)"
      }
    },
    {
      "id": "d",
      "text": {
        "ja": "染物青銅羅針盤風車織機灯台渡り鳥鐘楼滝壺渓流鍾乳",
        "en": "Dummy choice D of Q-NET.1-0019"
      },
      "isCorrect": false,
      "rationale": {
        "ja": "選択肢Dが誤り理由(ダミー)",
        "en": "Why choice D is incorrect (dummy)"
      },
      "mistakeTags": [
        "requirementMismatch"
      ]
    }
  ],
  "references": [
    {
      "title": "Google Cloud ドキュメント",
      "url": "https://cloud.google.com/docs",
      "license": "link-only"
    }
  ]
}
