{
  "id": "Q-NET.1-0023",
  "revision": 1,
  "examGuideVersion": "1.0",
  "domain": 2,
  "subObjective": "NET.1",
  "caseStudy": null,
  "type": {
    "kind": "single"
  },
  "difficulty": 4,
  "wafPillars": [
    "governance"
  ],
  "keywords": [
    "ダミー",
    "鐘楼"
  ],
  "examSets": [
    1
  ],
  "stem": {
    "ja": "【ダミー】温室・画廊・楽譜・棚田・染物に関する設問。",
    "en": "Dummy question stem for Q-NET.1-0023."
  },
  "choices": [
    {
      "id": "a",
      "text": {
        "ja": "彗星庭園画廊洞窟灯籠石畳草原流星灯台彗星珊瑚彗星宿場彫刻製",
        "en": "Dummy choice A of Q-NET.1-0023"
      },
      "isCorrect": false,
      "rationale": {
        "ja": "選択肢Aが誤り理由(ダミー)",
        "en": "Why choice A is incorrect (dummy)"
      },
      "mistakeTags": [
        "deprecated"
      ]
    },
    {
      "id": "b",
      "text": {
        "ja": "温室舞台洞窟風車砂丘化石刺繍劇場果樹園笛吹茶室合唱灯籠流星青銅",
        "en": "Dummy choice B of Q-NET.1-0023"
      },
      "isCorrect": false,
      "rationale": {
        "ja": "選択肢Bが誤り理由(ダミー)",
        "en": "Why choice B is incorrect (dummy)"
      },
      "mistakeTags": [
        "cost"
      ]
    },
    {
      "id": "c",
      "text": {
        "ja": "珊瑚水路草原銀河製本鐘楼刺繍製本雪原渡り鳥草原噴水鍾乳",
        "en": "Dummy choice C of Q-NET.1-0023"
      },
      "isCorrect": true,
      "rationale": {
        "ja": "選択肢Cが正しい理由(ダミー)",
        "en": "Why choice C is correct (dummy)"
      }
    },
    {
      "id": "d",
      "text": {
        "ja": "竹林太鼓湿原滝壺合唱峡谷製本",
        "en": "Dummy choice D of Q-NET.1-0023"
      },
      "isCorrect": false,
      "rationale": {
        "ja": "選択肢Dが誤り理由(ダミー)",
        "en": "Why choice D is incorrect (dummy)"
      },
      "mistakeTags": [
        "compliance"
      ]
    }
  ],
  "references": [
    {
      "title": "Google Cloud ドキュメント",
      "url": "https://cloud.google.com/docs",
      "license": "link-only"
    }
  ]
}
